<?xml version="1.0" encoding="UTF-8"?>
<xs:schema xmlns:xs="http://www.w3.org/2001/XMLSchema">
    <xs:element name="empresa">
        <xs:complexType>
            <xs:sequence>
                <xs:element name="persona" maxOccurs="unbounded">
                    <xs:complexType>
                        <xs:sequence>
                            <xs:element name="nombre" type="xs:string"></xs:element>
                            <xs:element name="usuario" type="xs:string"></xs:element>
                            
                            <xs:element name="contra">
                                <xs:simpleType>
                                    <xs:restriction base="xs:string">
                                        <xs:minLength value="5"/>
                                    </xs:restriction>
                                </xs:simpleType>
                            </xs:element>

                            <xs:element name="email">
                                <xs:simpleType>
                                    <xs:restriction base="xs:string">
                                        <xs:pattern value="[a-zA-Z0-9._%+-]+@[a-zA-Z0-9.-]+\.[a-zA-Z]{2,4}"/>
                                    </xs:restriction>
                                </xs:simpleType>
                            </xs:element>

                            <xs:element name="adoptante" type="xs:boolean"></xs:element>
                            <xs:element name="voluntario" type="xs:boolean"></xs:element>
                            <xs:element name="donante" type="xs:boolean"></xs:element>
                        </xs:sequence>
                        
                        <xs:attribute name="dni">
                            <xs:simpleType>
                                <xs:restriction base="xs:string">
                                    <xs:pattern value="9"/>
                                </xs:restriction>
                            </xs:simpleType>
                        </xs:attribute>

                    </xs:complexType>
                </xs:element>
            </xs:sequence>
            <xs:attribute name="nombreEmpresa" type="xs:string" use="required"></xs:attribute>
        </xs:complexType>
    </xs:element>
</xs:schema>